行政區,建照年度,完工年度,建案名稱,基地面積(坪),建蔽面積(坪),建蔽率(%),容積率(%),公設比(%),棟數,地上樓層,地下樓層,總戶數,平面車位,機械車位,總車位數,預估工期,建造執照,預估工期.1,投資建設,建築設計,營造公司,企劃銷售,結構工程,座向規劃,車位規劃,車位配比,用途規劃,土地分區,管理費用,景觀設計,公設設計,燈光設計,棟戶規劃,樓層規劃,基地地址,建材說明,url,爬蟲耗時(秒),更新日期,sell type
大安區,106,113,親家JIA,391.0,151,38.66,300,38,1,13,3,107,60,0,60,7,106建字第0192號,7,親家地產,陳廷杰建築師事務所,東霙營造,萬群廣告企劃,RC鋼筋混凝土結構,朝北、朝南,平面式60個,1:0.56,住商用,第三之一種住宅區(特),150元/坪/月,無,無,無,1幢，1棟，105戶住家，2戶店面,地上13層，地下3層,台北市大安區安東街、安東街35巷交叉口,GROHE馬桶、面盆、龍頭、淋浴花灑系統；TEKA抽油煙機；TOSTEM氣密窗；Yale電子鎖，Kohler化妝鏡櫃，四合一暖風機，Bosch洗脫烘，ＩＨ爐,https://newhouse.591.com.tw/126518/detail,83,2022-10-26,newhouse
大安區,106,隨時交屋,大安滕,128.0,57,45.0,400,35.8,1,12,2,45,0,35,35,NA,106建字第0227號,NA,柏嘉開發(志榮建設),郭旭原建築師事務所,山發營造,志榮建設,RC鋼筋混凝土結構,朝南、朝西,機械式35個,1:0.78,住商用,第三之二種住宅區,200元/坪/月,大尺設計-黃惠美總監,大尺設計-黃惠美總監,大尺設計-黃惠美總監,1幢，1棟，44戶住家，1戶店面,地上12層，地下2層,台北市大安區新生南路一段145號,採用YKK、TOSTEM、三協同等級氣密隔音窗，TOTO浴室換氣暖房乾燥機、TOTODH馬桶。,https://newhouse.591.com.tw/123527/detail,83,2022-10-26,newhouse
大安區,NA,110,敦南好好,152.0,48,31.98,225,36.14,1,10,2,27,4,12,16,NA,NA,NA,安家道生,鄭誌明建築師事務所,王工南營造,海沃創意行銷,RC,朝東北、朝西南、朝西北,平面式4個、機械式12個、無充電樁,1:0.57,住家用,第三種住宅區、第三之一種住宅區,180元/戶/月,三十三設計,珩荷空間設計,NA,1棟，27戶住家,"地上10層,地下2層",台北市大安區樂業街72巷22號,林內三機、HANSGROHE龍頭五金、KOHLER衛浴、BWT活水系統、Yale電子鎖，義大利Indesit洗脫烘，DORIS廚具，美國KOHLER全自動智慧單體免治馬桶，美國YALE電子鎖，德國hansgrohe衛浴五金。,https://market.591.com.tw/49551,54,2022-10-27,market
大安區,105,隨時交屋,睿泰美,98.0,60,61.5,630,39.6,1,9,2,19,0,14,14,NA,105建字第0226號,NA,睿泰開發,張全智建築師事務所,傑昇營造,睿泰開發,RC鋼筋混凝土結構,朝南,機械式14個,1:0.74,商業用,第二種商業區,150元/坪/月,無,無,無,1棟，19戶一般事務所,地上9層，地下2層,台北市大安區基隆路二段132巷2號,三菱電梯10人座、速度105m/s、安全到樓機能(SLF)、光幕式門檔、讀卡機樓層管制系統。菱光機械大型休旅車倉儲式車位、油壓升降、噪音低且出車快速。中華鋁門窗，台玻8mm強化玻璃，氣密、水密及隔音。玄關門採維夫拉克電子感應門鎖系統，搭配感應卡及機械鑰匙兩種開門方式。,https://newhouse.591.com.tw/124467/detail,82,2022-10-26,newhouse
大安區,NA,109,清歡,299.0,134,45.0,225,33.3,1,14,4,27,56,0,56,NA,NA,NA,鼎美建設,陳麗珍,金弘承營造,傳真機構‧傳美廣告,RC,朝南,平面式56個、無充電樁,1:2.07,住家用,第三種住宅區,13000元/坪/月,盧胤翰,關傳雍,大公造明,1棟，27戶住家,"地上14層,地下4層",台北市大安區杭州南路二段25巷41號,暫無,https://market.591.com.tw/35874,56,2022-10-26,market
文山區,111,116,公園首璽,400.0,180,45.0,225,34.8,1,14,4,65,75,0,75,5,111建字第0033號(改照中),5,僑府興建設、五十甲建設開發,蕭家福聯合建築師事務所,待定,五十甲建築行銷團隊,RC鋼筋混凝土結構,朝西北、朝東南,平面式75個、預留充電樁管線,1:1.15,住家用,第三種住宅區,100元/坪/月,方極景觀,方極景觀,元佑設計,1幢，1棟，65戶住家,地上14層，地下4層,台北市文山區木新路二段218巷32號對面,窗戶｜日本YKK-AP氣密窗玻璃｜5+5MM膠合強化玻璃廚具｜義大利CESAR原裝進口櫥櫃、美國杜邦人造石檯面、德國BOSCH微波烤箱、林內內焰玻璃雙口爐、林內超薄抽油煙機、林內烘碗機、諾德淨水器主浴｜日本TOTO單體馬桶搭配免治馬桶座、德國DURAVIT瓷器面盆、德國HANSGROHE控溫龍頭設備、德國LEICHT下體浴櫃、義大利Smavit鋼板琺瑯浴缸衛浴配件｜日本Panasonic多功能豪華型無線暖風機電梯｜MITSUBISHI三菱高級電梯其他｜屋頂及中庭採用德國頂級BASF聚脲塗料,https://newhouse.591.com.tw/130650/detail,82,2022-10-26,newhouse
文山區,109,115,青耘上,322.0,144,45.0,225,32.49,1,14,3,65,40,0,40,6,109建字第0150號(改照中),6,鴻暘建設(松陽機構),劉書豪+吳亞蘋建築師事務所,台新營造,鴻慶廣告,RC,朝北、朝南、朝東,平面式40個、無充電樁,200~220萬,住家用,第三種住宅區,(元/坪/月),六國,劉書豪+吳亞蘋建築師事務所,劉書豪+吳亞蘋建築師事務所,1幢，1棟，65戶住家,"地上14層,地下3層",台北市文山區光輝路22巷,待定,https://market.591.com.tw/5880751,53,2022-10-26,market
文山區,NA,114,樹語院,2016.0,710,35.22,120,32.69,12,5,3,106,137,0,137,NA,NA,NA,和暘建設,太乙建築師事務所(鄧毅仁),騰森營造,美學生活置業,RC,朝北、朝南,平面式137個、預留管線,1:1.28,住家用,第二種住宅區、第三種住宅區,90元/坪/月,老圃,李文勝建築師事務所,日大,5幢，12棟，106戶住家,"地上5層,地下3層",台北市文山區秀明路一段185巷20號,RC鋼筋混凝土,https://market.591.com.tw/5854630,53,2022-10-26,market
文山區,NA,114,吉美君悦,426.0,242,57.0,560,33.8,1,24,5,163,99,19,118,NA,NA,NA,吉美建設,陳浩怡建築師事務所,暫無,傳真實業,RC,朝西南、朝東,平面式99個、機械式19個、無充電樁,1:0.72,住商用,第三種商業區,120元/戶/月,聿善,築內國際企業,NA,1幢，1棟，153戶住家，10戶店面,"地上24層,地下5層",台北市文山區羅斯福路六段455巷口,櫻花廚具、TOTO衛浴、hansgrohe五金,https://market.591.com.tw/3668828,53,2022-10-26,market
文山區,NA,114,岳泰峰悦,294.0,119,40.56,225,34.5,1,9,3,25,38,0,38,NA,NA,NA,岳泰建設,謝仕煌建築師事務所,待定,詮力實業,RC,朝西、朝東,平面式38個、有充電樁,1:1.52,住家用,第三種住宅區,120元/坪/月,NA,NA,NA,1幢，1棟，25戶住家,"地上9層,地下3層",台北市文山區新光路一段66巷,廚具：林內，衛浴：TOTO，五金：KULDI,https://market.591.com.tw/5868881,54,2022-10-26,market
文山區,NA,114,宏廷富山?,273.0,120,44.05,225,33,1,15,3,42,31,16,47,NA,NA,NA,宏廷建設,張玉樹建築師事務所,翊豐營造,禾合行銷,RC,朝東,平面式31個、機械式16個、無充電樁,1:1.12,住家用,第三種住宅區,100元/坪/月,兆軒設計,NA,NA,1幢，1棟，42戶住家,"地上15層,地下3層",台北市文山區富山路5號,廚具：林內雙口爐、林內排油煙機、喜特麗烘碗、BOSS無鉛龍頭、杜邦人造石檯面衛浴：TOTO　五金：Hansgrohe其他：五合一電子鎖、不二氣密窗、LOW-E5+6+5mm複層玻璃、新日鐵製震壁、人臉辨識系統,https://market.591.com.tw/105101,53,2022-10-27,market
文山區,110,114,天成河悅,116.0,69,60.15,360,37.8,1,13,3,36,1,26,27,4,110建字第0265號,4,新添成建設,卓培煙建築師事務所,仲城建築,新風尚開發,RC,朝北、朝南,平面式1個、機械式26個、有充電樁,1:0.75,住家用,第一種商業區,暫無,大沃國際設計,大沃國際設計,無,1幢，1棟，36戶住家,"地上13層,地下3層",台北市文山區景福街220號旁,BeckermannKüchen德國科技廚具、GROHE衛浴定溫淋浴系列、AXENT主浴免治遙控馬桶、Panasonic浴室多功能排風機、Kronotex德國進口木地板、SHOWA日本昭和鋁窗。,https://market.591.com.tw/5861748,57,2022-10-27,market
文山區,108,112,沐極,334.0,126,37.89,225,30.9,1,14,3,51,20,25,45,4,108建字第0099號,4,金門建設,葉錠坤建築師事務所,偉宏營造,自售,RC鋼筋混凝土結構,朝西南,平面式20個、機械式25個,1:0.88,住家用,第三種住宅區,100元/坪/月,無,無,無,1棟，51戶住家,地上14層，地下3層,台北市文山區興隆路三段304巷,三協隔音氣密窗、TOTO衛浴、國際牌四合一暖風機、林內牌三機、德國歐寶高級廚具、利邦studor吸氣閥、當層排氣、一卡通門禁管理系統,https://newhouse.591.com.tw/121693/detail,85,2022-10-27,newhouse
文山區,108,112,采采靚心,219.0,93,42.68,225,35.4,2,7,2,25,0,25,25,4,108建字第0222號,4,御府建設,黃秀莊建築師事務所,元洲營造,自售,RC鋼筋混凝土結構,朝西北,機械式25個,1:1,住家用,第三種住宅區,120元/坪/月,無,無,我行設計,1幢，2棟，25戶住家,地上7層，地下2層,台北市文山區興順街106號,德國GROHE衛浴龍頭、德國Villeroy&Boch衛浴瓷器、主臥日本INAX免治、大金變頻冷暖主機、DORMAKABA德國電子鎖、BWT淨水設備、漢斯廚具、DURGO吸氣閥,https://newhouse.591.com.tw/125340/detail,84,2022-10-26,newhouse
文山區,NA,113,元利森活莊園,2907.0,670,23.05,225,34,2,27,4,260,403,0,403,NA,NA,NA,元利建設企業,李天鐸建築師事務所,五益營造,新聯昌實業,SC,朝北、朝南、朝西、朝東,平面式403個、無充電樁,1:1.55,住家用,第三種住宅區,150元/戶/月,環藝工程,頡合設計,原碩照明,1幢，2棟，260戶住家,"地上27層,地下4層",台北市文山區木柵路一段．永建國小旁,廚具：林內衛浴：PANASONIC、TOTO、GROHE,https://market.591.com.tw/3694924,54,2022-10-27,market
文山區,109,113,忠泰湛,836.0,379,45.44,560,34,2,23,4,117,170,0,170,4,109建字第0212號,4,忠泰建設,陳傳宗建築師事務所/梅林克(日本),忠泰營造,忠泰房屋,RC,朝東,平面式170個、預留管線,1:1.45,住商用,第三種商業區,120元/坪/月,木荷景觀,禾邸設計,肯緒照明設計,1幢，2棟，109戶住家，8戶店面,"地上23層,地下4層",台北市文山區木新路、開元街口,林內廚具、DURAVIT衛浴、Hansgrohe五金,https://market.591.com.tw/5859668,54,2022-10-27,market
文山區,NA,113,遠雄晴川,748.0,367,49.11,560,35,1,29,5,168,171,0,171,NA,NA,NA,遠雄建設,三門聯合建築師事務所,遠雄營造,遠雄房地產,SRC,朝北、朝南,平面式171個、無充電樁,1:1.02,住商用,第三種商業區,3954元/戶/月,NA,NA,NA,1幢，1棟，158戶住家，10戶店面,"地上29層,地下5層",台北市文山區木柵路三段169巷10號,暫無,https://market.591.com.tw/49596,53,2022-10-26,market
文山區,NA,113,喆美,295.0,159,54.2,560,34.2,1,14,4,124,3,76,79,NA,NA,NA,左耳開發建設、華鋐企業,吳非士建築師事務所,暫無,信義代銷,RC、SRC,朝東北、朝西北、朝西南,平面式3個、機械式76個、無充電樁,1:0.64,住商用,第三種商業區,100元/戶/月,六國,陳鵬旭,吳非士建築師事務所,1幢，1棟，112戶住家，12戶店面,"地上14層,地下4層",台北市文山區景後街180號,林內廚具、TOTO衛浴、YKK氣密窗、DURGO吸氣閥、BWT淨水器、LOW-E玻璃、隔熱沙漿、3M廚下型生飲,https://market.591.com.tw/3667193,54,2022-10-27,market
文山區,NA,113,久康青沺,172.0,72,42.17,225,34,1,12,2,38,2,19,21,NA,NA,NA,豪盛建設,PGA周簡建築事務所,偉信營造,信義代銷,RC,朝東、朝東南、朝西,平面式2個、機械式19個、無充電樁,1:0.55,住家用,第三種住宅區,120元/戶/月,NA,NA,NA,1棟，38戶住家,"地上12層,地下2層",台北市文山區木柵路三段85巷,櫻花廚具、TOTO衛浴、YKK窗框搭配5+5Low-E玻璃、sunon雙流新風機,https://market.591.com.tw/103129,57,2022-10-26,market
文山區,NA,113,和邦羅斯芙,92.0,38,42.3,225,39,1,11,2,30,0,11,11,NA,NA,NA,和邦建設,葉育廷、尹彥程建築師事務所,暫無,金磚動力行銷,RC,朝東北、朝東南,機械式11個、無充電樁,1:0.37,住家用,住宅區,150元/坪/月,NA,許植昀,NA,1幢，1棟，30戶住家,"地上11層,地下2層",台北市文山區羅斯福路六段與育英街口,studor通氣防疫系統、GreenWER防霾紗網、TOTO浴室止滑磚&奈米填縫劑、TOTOWaSHLET+單體式馬桶、SAKURA櫻花廚具+微波烤爐&淨水器、hansgrohe五金龍頭、KOHLER浴室六合一暖風機、innoci浴櫃&鏡櫃、SHOWA氣密窗、KRONOTEX木地板&EP防潮隔音墊、60A等級防火遮煙鑄鋁鋼木藝術門、dormakaba四合一電子鎖、SECOM中興保全智慧安全系統、WAGO電力安全接線工法、L-Best鋇斯特電動曬衣架,https://market.591.com.tw/3695032,57,2022-10-26,market
文山區,NA,112,松露院,2673.0,924,34.58,225,32,3,11,3,79,94,0,94,NA,NA,NA,咊暘建設,鍾美惠建築師事務所,暫無,光合行銷,RC,朝西、朝南、朝西北、朝西南,平面式94個、無充電樁,1:1.19,住家用,第三種住宅區,100元/戶/月,NA,NA,NA,3棟，79戶住家,"地上11層,地下3層",台北市文山區秀明路二段,RC,https://market.591.com.tw/101335,53,2022-10-26,market
文山區,NA,112,蔚來之森,1911.0,229,12.0,120,35,4,5,3,58,25,42,67,NA,NA,NA,恆德建設,謝仕煌建築師事務所,暫無,光合行銷,RC,朝東,平面式25個、機械式42個、無充電樁,1:1.16,住家用,第二種住宅區、住宅區,3185元/戶/月,NA,NA,NA,4幢，4棟，58戶住家,"地上5層,地下3層",台北市文山區福興路97號,RC鋼筋混凝土,https://market.591.com.tw/3681798,54,2022-10-26,market
文山區,NA,112,台大公館,607.0,252,41.64,225,34,2,15,4,117,110,0,110,NA,NA,NA,元興建設,李文勝建築師事務所,暫無,海悅地產開發,RC,朝西、朝東,平面式110個、無充電樁,1:0.94,住家用,第三種住宅區,4621元/戶/月,一口設計,王思敏,陳宇晃,1幢，2棟，117戶住家,"地上15層,地下4層",台北市文山區溪州街67號旁,Noblessa廚具；TOTO、Hansgrohe衛浴,https://market.591.com.tw/104142,54,2022-10-26,market
文山區,106,112,政大爵鼎NO.1,135.0,58,43.34,225,39.8,1,8,3,36,0,16,16,6,106建字第215號,6,富鉅祿建設,游素秋建築師事務所,昱嘉營造,詮力實業,RC,朝南,機械式16個、無充電樁,1:0.44,住家用,第三種住宅區,150元/戶/月,六國,科益室內裝修,吳非士建築師事務所,1棟，36戶住家,"地上8層,地下3層",台北市文山區指南路三段77巷,結構規劃：周泉盛結構技師英國Studor排水通氣防疫系統、德國BWT全自動前置過濾系統、長庚諧振活化水系統、美國Everpure廚下生飲淨水器、廚下雙溫加熱器、日系showa鋁門窗，搭配5+10+5Low-E複層中空玻璃、三菱變頻智能電梯、櫻花三機、和成牌超級馬桶、和成牌多功能暖風機、德國超耐磨木地板(搭配減噪21dB隔音墊)、美國Kwikset四合一指紋密碼鎖、感應式信箱、社區門禁人臉辨識系統,https://market.591.com.tw/49622,54,2022-10-27,market
文山區,106,112,政大爵鼎NO.2,77.0,33,43.41,225,40,1,7,2,25,0,9,9,6,106建字第0185號,6,富鉅祿建設,游素秋建築師事務所,昱嘉營造,詮力實業,RC,朝北,機械式9個、無充電樁,1:0.36,住家用,第三種住宅區,150元/坪/月,無,科益室內裝修,無,1幢，1棟，25戶住家,"地上7層,地下2層",台北市文山區指南路三段77巷,結構規劃：周泉盛結構技師英國Studor排水通氣防疫系統、德國BWT全自動前置過濾系統、長庚諧振活化水系統、美國Everpure廚下生飲淨水器、廚下雙溫加熱器、日本showa鋁門窗，搭配5+10+5Low-E複層中空玻璃、三菱變頻智能電梯、Svago單口感應爐、櫻花牌排油煙機、櫻花牌烘碗機、和成牌超級馬桶、和成牌多功能暖風機、德國超耐磨木地板(搭配減噪21dB隔音墊)、美國Kwikset四合一指紋密碼鎖、社區門禁人臉辨識系統,https://market.591.com.tw/105089,53,2022-10-27,market
文山區,107,隨時交屋,自慢藏,860.0,297,34.6,360,31.9,2,22,4,165,171,0,171,4,107建字第0132號,4,沅利建設、巨悅建設,彭繼賢建築師事務所,日商日本國土開發,信義代銷,SRC鋼骨鋼筋混凝土結構,朝東,平面式171個、有充電樁,1:1.04,住商用,第一種商業區,120元/坪/月,頤和設計、大漢景觀設計工程,頤和設計、大漢景觀設計工程,待定,2幢，2棟，161戶住家，4戶店面,地上22層，地下4層,台北市文山區汀洲路四段281~291號,林內廚具、TOTO衛浴、Hansgrohe五金,https://newhouse.591.com.tw/127371/detail,82,2022-10-27,newhouse
文山區,106,111,天賞大願,921.0,432,47.01,560,33.5,2,21、29,4,253,89,209,298,5,106建字第0139號,5,兆晉建設、璞石建設,呂建勳建築師事務所,待定,璞全廣告,SC鋼骨結構,朝東,平面式89個、機械式209個,1:1.18,住商用,第三種商業區,90元/坪/月,暫無,暫無,暫無,2棟，245戶住家，8戶店面,地上21、29層，地下4層,台北市文山區保儀路50號,panasonic廚具、ToTo衛浴、panasonic全熱交換器,https://newhouse.591.com.tw/115024/detail,86,2022-10-26,newhouse
文山區,105,隨時交屋,文山晶硯,98.0,44,45.0,225,36.4,1,9,1,23,0,9,9,NA,105建字第0155號,NA,東其建設,林隆成建築師事務所,裕臺營造,東其建設,RC鋼筋混凝土結構,朝西北,機械式9個,1:0.39,住家用,第三種住宅區,100元/坪/月,無,無,陳琨皓設計師、彭薇蓁設計師,1幢，1棟，23戶住家,地上9層，地下1層,台北市文山區忠順街一段41巷8號及光輝路134巷口,SAKURA廚具、TOTO衛浴,https://newhouse.591.com.tw/127125/detail,81,2022-10-27,newhouse
文山區,104,隨時交屋,玖原青,69.0,31,45.0,225,31,1,7,1,13,0,7,7,NA,104建字第0040號,NA,玖祐建設,黃翔龍建築師事務所,富霖營造,玖祐建設,RC鋼筋混凝土結構,朝西北、朝東南,機械式7個,1:0.54,住商用,第三種住宅區,待定,禹連泉設計,禹連泉設計,禹連泉設計,1棟，12戶住家，1戶店面,地上7層，地下1層,台北市文山區育英街83號,林內廚具、德國GROHE衛浴,https://newhouse.591.com.tw/126349/detail,85,2022-10-26,newhouse
文山區,,104,岳泰峰範,1282.0,782,61.06,560,34,2,33,6,238,470,0,470,NA,,NA,岳泰建設,王文凱(元宏聯合建築師事務所),林金塗(鵬霖營造),岳泰建設,SRC,朝西、朝東北,平面式470個、無充電樁,1:1.97,住家用,第三種商業區,4263元/戶/月,何鴻志建築師事務所,何鴻志建築師事務所,騰雲設計,2棟，231戶住家，7戶店面,"地上33層,地下6層",台北市文山區景文街86號,暫無,https://market.591.com.tw/7192,53,2022-10-26,market
松山區,110,113,鐫萃,603.0,317,52.62,630,37,2,23、24,6,118,119,8,127,3,110建字第0101號,3,大陸建設＆台北馥敦飯店,陳廷杰建築師事務所、ACPV建築設計團隊,大陸工程,甲桂林廣告,SC鋼骨結構,朝南,平面式119個、機械式8個,1:1.08,住商用,第二種商業區，第三種住宅區,待定,ACPV建築設計團隊,ACPV建築設計團隊,ACPV建築設計團隊,1幢，2棟，116戶住家，1戶一般旅館業，1戶事務所,地上23、24層，地下6層,台北市松山區南京東路五段32號,SC鋼骨,https://newhouse.591.com.tw/127900/detail,84,2022-10-26,newhouse
松山區,110,113,敦北南京,190.0,123,65.0,560,31,1,15,4,84,1,48,49,3,110建字第166號,3,敦年建設,台北國際聯合建築師事務所,久年營造,元陞廣告,RC鋼筋混凝土結構,朝北、朝南,平面式1個、機械式48個,1:0.58,住商用,商三特(商二),150元/坪/月,無,無,陳天祥建築師,1幢，1棟，81戶住家，3戶店面,地上15層，地下4層,台北市松山區南京東路四段63號旁,Panasonic廚具、Kohler衛浴、Hansgrohe五金設備,https://newhouse.591.com.tw/128006/detail,86,2022-10-26,newhouse
松山區,110,115,吉美艾麗,210.0,142,68.0,560,35.77,1,14,4,105,39,10,49,5,110建字第0271號,5,吉美建設,陳浩怡建築師事務所,待定,好德麥實業,RC鋼筋混凝土結構,朝北,平面式39個、機械式10個,1:0.47,住商用,第三種商業區,待定,聿善景觀設計,聿善景觀設計,築內設計,1幢，1棟，102戶住家，2戶店面，1戶宗教建築,地上14層，地下4層,台北市松山區八德路四段480號,外觀設計：MAG玫格設計。建材：廚具ODDO廚飾、德國HETTICE絞鍊、美國杜邦人造石檯面、櫻花烘碗機、隱藏式除油煙機、SVAGO雙口感應爐、3M淨水器、SVAGO洗脫烘、BUDER加熱器。衛浴：TOTO最新式全自動馬桶、德國GROHE衛浴設備、德國KALDEWEI浴缸。其他：日本三協鋁窗、LOW-E玻璃、瑞典DURGO吸氣閥、德國太格木地板、六合一電子門鎖、長庚活水系統。,https://newhouse.591.com.tw/129101/detail,89,2022-10-26,newhouse
松山區,109,111,敦化豐華,201.0,98,49.0,560,36,1,11,3,23,28,0,28,2,109建字第0208號,2,豐華開發,林志崧建築師事務所,地樺營造,新聯陽機構－新聯祥廣告,RC鋼筋混凝土結構,朝北,平面式28個,1:1.22,住商用,商三特,待定,林志崧建築師事務所,林志崧建築師事務所,林志崧建築師事務所,1幢，1棟，19戶住家，4戶店面,地上11層，地下3層,台北市松山區南京東路三段256巷53號旁,結構設計:聯邦工程顧問,https://newhouse.591.com.tw/125641/detail,99,2022-10-26,newhouse
松山區,NA,114,衍見築,394.0,176,44.9,225,33.8,1,17,4,45,71,0,71,NA,NA,NA,忠泰建設、永沛開發建設,奧伊勒吳聯合事務所、王克誠建築師事務所,忠泰營造,璞全廣告,SC,朝北、朝南、朝東,平面式71個、無充電樁,1:1.58,住家用,第三種住宅區,暫無,木荷景觀,築內國際,十聿照明,1幢，1棟，45戶住家,"地上17層,地下4層",台北市松山區敦化北路120巷,待定,https://market.591.com.tw/105144,53,2022-10-27,market
松山區,NA,114,敦北文華,166.0,74,44.98,225,33.8,1,10,2,33,2,23,25,NA,NA,NA,淞瀚建設、磐鼎建設,葉錠坤建築師事務所,億東營造,桔禾行銷,RC,朝東、朝北,平面式2個、機械式23個、無充電樁,1:0.76,住商用,第三種住宅區,暫無,NA,NA,NA,1幢，1棟，31戶住家，2戶店面,"地上10層,地下2層",台北市松山區南京東路四段52巷21號旁,待定,https://market.591.com.tw/104205,55,2022-10-26,market
松山區,108,112,民生鉑月,416.0,186,44.94,225,31.31,1,12、15,4,68,93,4,97,4,108建字第0109號,4,將作建設,鍾美惠建築師事務所,大盈營造,自售,RC鋼筋混凝土結構,朝南、朝東,平面式93個、機械式4個,1:1.43,住家用,第三種住宅區,100元/坪/月,9STUDIODESIGNGROU,9STUDIODESIGNGROU,9STUDIODESIGNGROU,2幢，1棟，68戶住家,地上12、15層，地下4層,台北市松山區延壽街18巷1號,建材:DAIKINPM2.5過濾器+全熱交換器。DAIKIN冷暖變頻室外主機。TOTO衛浴、YKK氣密窗。高彩度廣角魚眼攝影機。SMART-KEY智慧感應讀卡系統。義大利進口CIAS門鎖、日本進口CLEANUP櫥具。,https://newhouse.591.com.tw/125023/detail,84,2022-10-27,newhouse
松山區,108,113,碧硯閣,1446.0,562,38.9,225,31,4,24,4,290,309,0,309,5,108建字第0140號,5,中華工程,張玉樹建築師事務所,中華工程,自售,SRC鋼骨鋼筋混凝土結構,朝北、朝南,平面式309個,1:1.07,住商用,第三種住宅區,待定,境業設計工程,境業設計工程,境業設計工程,4幢，4棟，278戶住家，12戶店面,地上24層，地下4層,台北市松山區三民路80巷及延壽街72巷,Dormakaba玄關門鎖、YKK室內鋁窗(玻璃)、KOHLER廚具、康沛石檯面、林內三口瓦斯爐、林內隱藏式排油煙機、林內廚下型烘碗機、Hansgrohe廚房伸縮龍頭、諾得廚下型淨水器。主浴室：BLB浴缸、Hansgrohe浴缸水龍頭、Hansgrohe手持花灑+升降桿組、KOHLER馬桶、KOHLER方形下崁面盆、Hansgrohe單槍面盆龍頭。客浴室：Hansgrohe淋浴龍頭、Hansgrohe手持花灑+升降桿組、KOHLER馬桶+免治馬桶座、KOHLER方形下崁面盆、Hansgrohe面盆龍頭。,https://newhouse.591.com.tw/128909/detail,82,2022-10-26,newhouse
松山區,NA,113,陞遠學,118.0,57,49.13,225,36.8,1,10,2,25,0,18,18,NA,NA,NA,陞遠建設開發,陳建宏建築師事務所,暫無,賦盈廣告行銷,RC,朝北、朝南,機械式18個、無充電樁,1:0.72,住家用,第三種住宅區,130元/坪/月,和築設計,和築設計,和築設計,1幢，1棟，25戶住家,"地上10層,地下2層",台北市松山區南京東路四段120巷19弄28號,待定。,https://market.591.com.tw/3645955,54,2022-10-26,market
松山區,NA,111,松蔦青語,201.0,120,60.0,560,33,1,15,3,112,0,47,47,NA,NA,NA,大家地產,林祺錦建築師事務所,大家營造,潤鼎廣告,RC,朝東、朝南,機械式47個、無充電樁,1:0.42,住商用,第三種商業區,90元/坪/月,林祺錦建築師事務所,林祺錦建築師事務所,林祺錦建築師事務所,1幢，1棟，108戶住家，4戶店面,"地上15層,地下3層",台北市松山區松河街76號,廚具：高級歐式陶磁鋼烤面板廚具、杜邦人造石檯面、櫻花抽油煙機、玻璃檯面式瓦斯爐（部分戶別）、進口高級IH爐（部分戶別）、BOSCH洗碗機、HANSGROHE洗槽龍頭、廚下生飲淨水器、雙溫飲水龍頭。衛浴：Panasonic全自動電腦免治馬桶、KOHLER鏡箱、INNOCI一體化陶瓷檯面盆及鋼琴烤漆浴室櫃、HANSGROHE龍頭、淋浴蓮蓬頭及花灑。五金：HANSGROHE。其他：EDS制震壁40組（2~6F）、德國BWT大樓淨水設備、玄關電子門鎖、STUDOR吸氣閥、FTTH光纖到府、雨水回收系統。,https://market.591.com.tw/102890,54,2022-10-26,market
